<?xml version="1.0" encoding="UTF-8"?>
<matricula xmlns:xsi="http://www.w3.org/2001/XMLSchema-instance"
           xsi:noNamespaceSchemaLocation="matricula.xsd">

  <personal>
    <dni>99223366M</dni>
    <nombre>Juan Pardo Martín</nombre>
    <titulacion>Ingeniería Informática</titulacion>
    <curso-academico>1997/1998</curso-academico>
    <domicilios>
      <domicilio tipo="familiar">
        <nombre>C/ Principal no1</nombre>
      </domicilio>
      <domicilio tipo="habitual">
        <nombre>C/ Secundaria no2</nombre>
      </domicilio>
    </domicilios>
  </personal>

  <pago>
    <tipo_matricula>Matrícula Ordinaria</tipo_matricula>
  </pago>

</matricula>
